<?xml version="1.0" encoding="UTF-8"?>
<!DOCTYPE AirlineSystem SYSTEM "HTMB.dtd">
<AirlineSystem xmlns="http://example.com/airline">

  <!-- ========================================================= -->
  <!-- 1 SÂN BAY - HỆ THỐNG SÂN BAY QUỐC TẾ VÀ NỘI ĐỊA -->
  <!-- ========================================================= -->
  <Airports>
    <Airport>
      <MaSanBay>SGN</MaSanBay>
      <TenSanBay>Sân bay Quốc tế Tân Sơn Nhất</TenSanBay>
      <ThanhPho>Thành phố Hồ Chí Minh</ThanhPho>
      <QuocGia>Việt Nam</QuocGia>
      <MaIATA>SGN</MaIATA>
    </Airport>
    <Airport>
      <MaSanBay>HAN</MaSanBay>
      <TenSanBay>Sân bay Quốc tế Nội Bài</TenSanBay>
      <ThanhPho>Hà Nội</ThanhPho>
      <QuocGia>Việt Nam</QuocGia>
      <MaIATA>HAN</MaIATA>
    </Airport>
    <Airport>
      <MaSanBay>DAD</MaSanBay>
      <TenSanBay>Sân bay Quốc tế Đà Nẵng</TenSanBay>
      <ThanhPho>Đà Nẵng</ThanhPho>
      <QuocGia>Việt Nam</QuocGia>
      <MaIATA>DAD</MaIATA>
    </Airport>
    <Airport>
      <MaSanBay>PQC</MaSanBay>
      <TenSanBay>Sân bay Quốc tế Phú Quốc</TenSanBay>
      <ThanhPho>Phú Quốc</ThanhPho>
      <QuocGia>Việt Nam</QuocGia>
      <MaIATA>PQC</MaIATA>
    </Airport>
    <Airport>
      <MaSanBay>CXR</MaSanBay>
      <TenSanBay>Sân bay Quốc tế Cam Ranh</TenSanBay>
      <ThanhPho>Nha Trang</ThanhPho>
      <QuocGia>Việt Nam</QuocGia>
      <MaIATA>CXR</MaIATA>
    </Airport>
    <Airport>
      <MaSanBay>HUI</MaSanBay>
      <TenSanBay>Sân bay Phú Bài</TenSanBay>
      <ThanhPho>Huế</ThanhPho>
      <QuocGia>Việt Nam</QuocGia>
      <MaIATA>HUI</MaIATA>
    </Airport>
    <Airport>
      <MaSanBay>VCA</MaSanBay>
      <TenSanBay>Sân bay Cần Thơ</TenSanBay>
      <ThanhPho>Cần Thơ</ThanhPho>
      <QuocGia>Việt Nam</QuocGia>
      <MaIATA>VCA</MaIATA>
    </Airport>
    <Airport>
      <MaSanBay>VDH</MaSanBay>
      <TenSanBay>Sân bay Đồng Hới</TenSanBay>
      <ThanhPho>Quảng Bình</ThanhPho>
      <QuocGia>Việt Nam</QuocGia>
      <MaIATA>VDH</MaIATA>
    </Airport>
    <Airport>
      <MaSanBay>VCL</MaSanBay>
      <TenSanBay>Sân bay Chu Lai</TenSanBay>
      <ThanhPho>Quảng Nam</ThanhPho>
      <QuocGia>Việt Nam</QuocGia>
      <MaIATA>VCL</MaIATA>
    </Airport>
    <Airport>
      <MaSanBay>VII</MaSanBay>
      <TenSanBay>Sân bay Vinh</TenSanBay>
      <ThanhPho>Nghệ An</ThanhPho>
      <QuocGia>Việt Nam</QuocGia>
      <MaIATA>VII</MaIATA>
    </Airport>
    <Airport>
      <MaSanBay>BKK</MaSanBay>
      <TenSanBay>Suvarnabhumi Airport</TenSanBay>
      <ThanhPho>Bangkok</ThanhPho>
      <QuocGia>Thái Lan</QuocGia>
      <MaIATA>BKK</MaIATA>
    </Airport>
    <Airport>
      <MaSanBay>SIN</MaSanBay>
      <TenSanBay>Changi Airport</TenSanBay>
      <ThanhPho>Singapore</ThanhPho>
      <QuocGia>Singapore</QuocGia>
      <MaIATA>SIN</MaIATA>
    </Airport>
  </Airports>

  <!-- ========================================================= -->
  <!-- 2 TUYẾN BAY - MẠNG LƯỚI KẾT NỐI CÁC SÂN BAY -->
  <!-- ========================================================= -->
  <Routes>
    <Route>
      <MaTuyenBay>R001</MaTuyenBay>
      <MaSanBayDi>SGN</MaSanBayDi>
      <MaSanBayDen>HAN</MaSanBayDen>
      <KhoangCach>1150</KhoangCach>
    </Route>
    <Route>
      <MaTuyenBay>R002</MaTuyenBay>
      <MaSanBayDi>HAN</MaSanBayDi>
      <MaSanBayDen>DAD</MaSanBayDen>
      <KhoangCach>600</KhoangCach>
    </Route>
    <Route>
      <MaTuyenBay>R003</MaTuyenBay>
      <MaSanBayDi>SGN</MaSanBayDi>
      <MaSanBayDen>PQC</MaSanBayDen>
      <KhoangCach>305</KhoangCach>
    </Route>
    <Route>
      <MaTuyenBay>R004</MaTuyenBay>
      <MaSanBayDi>SGN</MaSanBayDi>
      <MaSanBayDen>CXR</MaSanBayDen>
      <KhoangCach>308</KhoangCach>
    </Route>
    <Route>
      <MaTuyenBay>R005</MaTuyenBay>
      <MaSanBayDi>HAN</MaSanBayDi>
      <MaSanBayDen>PQC</MaSanBayDen>
      <KhoangCach>1230</KhoangCach>
    </Route>
    <Route>
      <MaTuyenBay>R006</MaTuyenBay>
      <MaSanBayDi>HAN</MaSanBayDi>
      <MaSanBayDen>VCA</MaSanBayDen>
      <KhoangCach>1210</KhoangCach>
    </Route>
    <Route>
      <MaTuyenBay>R007</MaTuyenBay>
      <MaSanBayDi>DAD</MaSanBayDi>
      <MaSanBayDen>HUI</MaSanBayDen>
      <KhoangCach>66</KhoangCach>
    </Route>
    <Route>
      <MaTuyenBay>R008</MaTuyenBay>
      <MaSanBayDi>SGN</MaSanBayDi>
      <MaSanBayDen>VDH</MaSanBayDen>
      <KhoangCach>740</KhoangCach>
    </Route>
    <Route>
      <MaTuyenBay>R009</MaTuyenBay>
      <MaSanBayDi>SGN</MaSanBayDi>
      <MaSanBayDen>VII</MaSanBayDen>
      <KhoangCach>870</KhoangCach>
    </Route>
    <Route>
      <MaTuyenBay>R010</MaTuyenBay>
      <MaSanBayDi>HAN</MaSanBayDi>
      <MaSanBayDen>CXR</MaSanBayDen>
      <KhoangCach>1100</KhoangCach>
    </Route>
    <Route>
      <MaTuyenBay>R011</MaTuyenBay>
      <MaSanBayDi>SGN</MaSanBayDi>
      <MaSanBayDen>BKK</MaSanBayDen>
      <KhoangCach>800</KhoangCach>
    </Route>
    <Route>
      <MaTuyenBay>R012</MaTuyenBay>
      <MaSanBayDi>HAN</MaSanBayDi>
      <MaSanBayDen>SIN</MaSanBayDen>
      <KhoangCach>2200</KhoangCach>
    </Route>
  </Routes>

  <!-- ========================================================= -->
  <!-- 3 CHUYẾN BAY - CÁC CHUYẾN BAY THỰC TẾ -->
  <!-- ========================================================= -->
  <Flights>
    <Flight>
      <MaChuyenBay>VN123</MaChuyenBay>
      <SoHieu>VN123</SoHieu>
      <MaTuyenBay>R001</MaTuyenBay>
      <MaMayBay>A321</MaMayBay>
      <GioDi>2025-01-20T08:30:00</GioDi>
      <GioDen>2025-01-20T10:45:00</GioDen>
      <MauMaybay>Trắng-Xanh</MauMaybay>
      <SucChua>180</SucChua>
    </Flight>
    <Flight>
      <MaChuyenBay>VN456</MaChuyenBay>
      <SoHieu>VN456</SoHieu>
      <MaTuyenBay>R002</MaTuyenBay>
      <MaMayBay>A320</MaMayBay>
      <GioDi>2025-01-21T09:00:00</GioDi>
      <GioDen>2025-01-21T10:10:00</GioDen>
      <MauMaybay>Trắng-Đỏ</MauMaybay>
      <SucChua>170</SucChua>
    </Flight>
    <Flight>
      <MaChuyenBay>VJ201</MaChuyenBay>
      <SoHieu>VJ201</SoHieu>
      <MaTuyenBay>R003</MaTuyenBay>
      <MaMayBay>A321neo</MaMayBay>
      <GioDi>2025-01-22T07:15:00</GioDi>
      <GioDen>2025-01-22T08:10:00</GioDen>
      <MauMaybay>Đỏ-Vàng</MauMaybay>
      <SucChua>230</SucChua>
    </Flight>
    <Flight>
      <MaChuyenBay>QH310</MaChuyenBay>
      <SoHieu>QH310</SoHieu>
      <MaTuyenBay>R004</MaTuyenBay>
      <MaMayBay>Embraer190</MaMayBay>
      <GioDi>2025-01-22T13:20:00</GioDi>
      <GioDen>2025-01-22T14:25:00</GioDen>
      <MauMaybay>Xanh-Đỏ</MauMaybay>
      <SucChua>110</SucChua>
    </Flight>
    <Flight>
      <MaChuyenBay>VN789</MaChuyenBay>
      <SoHieu>VN789</SoHieu>
      <MaTuyenBay>R005</MaTuyenBay>
      <MaMayBay>B787-9</MaMayBay>
      <GioDi>2025-01-23T06:40:00</GioDi>
      <GioDen>2025-01-23T08:55:00</GioDen>
      <MauMaybay>Trắng-Xanh</MauMaybay>
      <SucChua>274</SucChua>
    </Flight>
    <Flight>
      <MaChuyenBay>VJ345</MaChuyenBay>
      <SoHieu>VJ345</SoHieu>
      <MaTuyenBay>R006</MaTuyenBay>
      <MaMayBay>A321</MaMayBay>
      <GioDi>2025-01-23T12:10:00</GioDi>
      <GioDen>2025-01-23T14:20:00</GioDen>
      <MauMaybay>Đỏ-Vàng</MauMaybay>
      <SucChua>220</SucChua>
    </Flight>
    <Flight>
      <MaChuyenBay>VN555</MaChuyenBay>
      <SoHieu>VN555</SoHieu>
      <MaTuyenBay>R007</MaTuyenBay>
      <MaMayBay>ATR72</MaMayBay>
      <GioDi>2025-01-24T10:00:00</GioDi>
      <GioDen>2025-01-24T10:25:00</GioDen>
      <MauMaybay>Trắng-Xanh</MauMaybay>
      <SucChua>68</SucChua>
    </Flight>
    <Flight>
      <MaChuyenBay>QH611</MaChuyenBay>
      <SoHieu>QH611</SoHieu>
      <MaTuyenBay>R008</MaTuyenBay>
      <MaMayBay>A320</MaMayBay>
      <GioDi>2025-01-24T15:30:00</GioDi>
      <GioDen>2025-01-24T16:50:00</GioDen>
      <MauMaybay>Xanh-Đỏ</MauMaybay>
      <SucChua>160</SucChua>
    </Flight>
    <Flight>
      <MaChuyenBay>VJ512</MaChuyenBay>
      <SoHieu>VJ512</SoHieu>
      <MaTuyenBay>R009</MaTuyenBay>
      <MaMayBay>A321</MaMayBay>
      <GioDi>2025-01-25T11:05:00</GioDi>
      <GioDen>2025-01-25T12:45:00</GioDen>
      <MauMaybay>Đỏ-Vàng</MauMaybay>
      <SucChua>220</SucChua>
    </Flight>
    <Flight>
      <MaChuyenBay>VN902</MaChuyenBay>
      <SoHieu>VN902</SoHieu>
      <MaTuyenBay>R010</MaTuyenBay>
      <MaMayBay>A350-900</MaMayBay>
      <GioDi>2025-01-25T17:20:00</GioDi>
      <GioDen>2025-01-25T19:10:00</GioDen>
      <MauMaybay>Trắng-Xanh</MauMaybay>
      <SucChua>305</SucChua>
    </Flight>
    <Flight>
      <MaChuyenBay>VN301</MaChuyenBay>
      <SoHieu>VN301</SoHieu>
      <MaTuyenBay>R011</MaTuyenBay>
      <MaMayBay>A350-900</MaMayBay>
      <GioDi>2025-01-26T14:00:00</GioDi>
      <GioDen>2025-01-26T16:30:00</GioDen>
      <MauMaybay>Trắng-Xanh</MauMaybay>
      <SucChua>305</SucChua>
    </Flight>
    <Flight>
      <MaChuyenBay>VN502</MaChuyenBay>
      <SoHieu>VN502</SoHieu>
      <MaTuyenBay>R012</MaTuyenBay>
      <MaMayBay>B787-9</MaMayBay>
      <GioDi>2025-01-27T20:15:00</GioDi>
      <GioDen>2025-01-28T01:45:00</GioDen>
      <MauMaybay>Trắng-Xanh</MauMaybay>
      <SucChua>274</SucChua>
    </Flight>
  </Flights>

  <!-- ========================================================= -->
  <!-- 4 HÀNH KHÁCH - THÔNG TIN KHÁCH HÀNG -->
  <!-- ========================================================= -->
  <DanhSachHanhKhach>
    <HanhKhach>
      <MaHK>HK001</MaHK>
      <HoTen>Nguyễn Văn An</HoTen>
      <NgaySinh>1990-05-12</NgaySinh>
      <Email>nguyen.van.an@gmail.com</Email>
      <DienThoai>0909123456</DienThoai>
      <SoHoChieu>P12345678</SoHoChieu>
    </HanhKhach>
    <HanhKhach>
      <MaHK>HK002</MaHK>
      <HoTen>Trần Thị Bình</HoTen>
      <NgaySinh>1995-08-20</NgaySinh>
      <Email>tran.thi.binh@yahoo.com</Email>
      <DienThoai>0912345678</DienThoai>
    </HanhKhach>
    <HanhKhach>
      <MaHK>HK003</MaHK>
      <HoTen>Lê Minh Cường</HoTen>
      <NgaySinh>1988-03-02</NgaySinh>
      <Email>le.minh.cuong@outlook.com</Email>
      <DienThoai>0933111222</DienThoai>